11:19:48.940376 IP 192.168.1.181.54555 > 255.255.255.255.7125: UDP, length 28
11:19:49.440394 IP 192.168.1.181.54555 > 255.255.255.255.7125: UDP, length 28
11:19:49.937226 IP 192.168.1.181.54555 > 255.255.255.255.7125: UDP, length 28
11:19:50.437199 IP 192.168.1.181.54555 > 255.255.255.255.7125: UDP, length 28
11:19:50.937188 IP 192.168.1.181.54555 > 255.255.255.255.7125: UDP, length 28
11:19:51.437204 IP 192.168.1.181.54555 > 255.255.255.255.7125: UDP, length 28
11:19:51.940369 IP 192.168.1.181.54555 > 255.255.255.255.7125: UDP, length 28
11:19:52.437206 IP 192.168.1.181.54555 > 255.255.255.255.7125: UDP, length 28
11:19:52.940559 IP 192.168.1.181.54555 > 255.255.255.255.7125: UDP, length 28
11:19:53.440399 IP 192.168.1.181.54555 > 255.255.255.255.7125: UDP, length 28
11:19:53.950379 IP 192.168.1.181.54555 > 255.255.255.255.7125: UDP, length 28
11:19:54.437206 IP 192.168.1.181.54555 > 255.255.255.255.7125: UDP, length 28
11:19:54.937195 IP 192.168.1.181.54555 > 255.255.255.255.7125: UDP, length 28
11:19:55.440421 IP 192.168.1.181.54555 > 255.255.255.255.7125: UDP, length 28
11:19:55.940379 IP 192.168.1.181.54555 > 255.255.255.255.7125: UDP, length 28
11:19:56.440430 IP 192.168.1.181.54555 > 255.255.255.255.7125: UDP, length 28
11:19:56.937180 IP 192.168.1.181.54555 > 255.255.255.255.7125: UDP, length 28
11:19:57.437204 IP 192.168.1.181.54555 > 255.255.255.255.7125: UDP, length 28
11:19:57.937173 IP 192.168.1.181.54555 > 255.255.255.255.7125: UDP, length 28
11:19:58.437201 IP 192.168.1.181.54555 > 255.255.255.255.7125: UDP, length 28
11:19:58.940389 IP 192.168.1.181.54555 > 255.255.255.255.7125: UDP, length 28
11:19:59.450460 IP 192.168.1.181.54555 > 255.255.255.255.7125: UDP, length 28
11:19:59.937173 IP 192.168.1.181.54555 > 255.255.255.255.7125: UDP, length 28
11:20:00.437187 IP 192.168.1.181.54555 > 255.255.255.255.7125: UDP, length 28
11:20:00.937167 IP 192.168.1.181.54555 > 255.255.255.255.7125: UDP, length 28
11:20:01.460388 IP 192.168.1.181.54555 > 255.255.255.255.7125: UDP, length 28
11:20:01.939737 IP 192.168.1.181.54555 > 255.255.255.255.7125: UDP, length 28
11:20:02.440412 IP 192.168.1.181.54555 > 255.255.255.255.7125: UDP, length 28
11:20:02.937169 IP 192.168.1.181.54555 > 255.255.255.255.7125: UDP, length 28
11:20:03.440387 IP 192.168.1.181.54555 > 255.255.255.255.7125: UDP, length 28
11:20:03.937152 IP 192.168.1.181.54555 > 255.255.255.255.7125: UDP, length 28
11:20:04.439029 IP 192.168.1.181.54555 > 255.255.255.255.7125: UDP, length 28
11:20:04.937156 IP 192.168.1.181.54555 > 255.255.255.255.7125: UDP, length 28
11:20:05.450379 IP 192.168.1.181.54555 > 255.255.255.255.7125: UDP, length 28
11:20:05.940344 IP 192.168.1.181.54555 > 255.255.255.255.7125: UDP, length 28
11:20:06.437175 IP 192.168.1.181.54555 > 255.255.255.255.7125: UDP, length 28
11:20:06.937201 IP 192.168.1.181.54555 > 255.255.255.255.7125: UDP, length 28
11:20:07.450452 IP 192.168.1.181.54555 > 255.255.255.255.7125: UDP, length 28
11:20:07.937122 IP 192.168.1.181.54555 > 255.255.255.255.7125: UDP, length 28
11:20:08.437214 IP 192.168.1.181.54555 > 255.255.255.255.7125: UDP, length 28
11:20:08.940379 IP 192.168.1.181.54555 > 255.255.255.255.7125: UDP, length 28
11:20:09.440413 IP 192.168.1.181.54555 > 255.255.255.255.7125: UDP, length 28
11:20:09.940367 IP 192.168.1.181.54555 > 255.255.255.255.7125: UDP, length 28
11:20:10.437197 IP 192.168.1.181.54555 > 255.255.255.255.7125: UDP, length 28
11:20:10.937186 IP 192.168.1.181.54555 > 255.255.255.255.7125: UDP, length 28
11:20:11.440384 IP 192.168.1.181.54555 > 255.255.255.255.7125: UDP, length 28
11:20:11.940405 IP 192.168.1.181.54555 > 255.255.255.255.7125: UDP, length 28
11:20:12.437193 IP 192.168.1.181.54555 > 255.255.255.255.7125: UDP, length 28
11:20:12.937170 IP 192.168.1.181.54555 > 255.255.255.255.7125: UDP, length 28
11:20:13.437196 IP 192.168.1.181.54555 > 255.255.255.255.7125: UDP, length 28
11:20:13.937194 IP 192.168.1.181.54555 > 255.255.255.255.7125: UDP, length 28
11:20:14.449522 IP 192.168.1.181.54555 > 255.255.255.255.7125: UDP, length 28
11:20:14.940389 IP 192.168.1.181.54555 > 255.255.255.255.7125: UDP, length 28
11:20:15.437183 IP 192.168.1.181.54555 > 255.255.255.255.7125: UDP, length 28
11:20:15.940411 IP 192.168.1.181.54555 > 255.255.255.255.7125: UDP, length 28
11:20:16.440366 IP 192.168.1.181.54555 > 255.255.255.255.7125: UDP, length 28
11:20:16.937193 IP 192.168.1.181.54555 > 255.255.255.255.7125: UDP, length 28
11:20:17.437200 IP 192.168.1.181.54555 > 255.255.255.255.7125: UDP, length 28
11:20:17.937173 IP 192.168.1.181.54555 > 255.255.255.255.7125: UDP, length 28
11:20:18.440399 IP 192.168.1.181.54555 > 255.255.255.255.7125: UDP, length 28
11:20:18.940394 IP 192.168.1.181.54555 > 255.255.255.255.7125: UDP, length 28
11:20:19.450389 IP 192.168.1.181.54555 > 255.255.255.255.7125: UDP, length 28
11:20:19.937170 IP 192.168.1.181.54555 > 255.255.255.255.7125: UDP, length 28
11:20:20.437234 IP 192.168.1.181.54555 > 255.255.255.255.7125: UDP, length 28
11:20:20.950367 IP 192.168.1.181.54555 > 255.255.255.255.7125: UDP, length 28
11:20:21.437138 IP 192.168.1.181.54555 > 255.255.255.255.7125: UDP, length 28
11:20:21.940386 IP 192.168.1.181.54555 > 255.255.255.255.7125: UDP, length 28
11:20:22.450396 IP 192.168.1.181.54555 > 255.255.255.255.7125: UDP, length 28
11:20:22.937165 IP 192.168.1.181.54555 > 255.255.255.255.7125: UDP, length 28
11:20:23.437192 IP 192.168.1.181.54555 > 255.255.255.255.7125: UDP, length 28
11:20:23.940367 IP 192.168.1.181.54555 > 255.255.255.255.7125: UDP, length 28
11:20:24.437206 IP 192.168.1.181.54555 > 255.255.255.255.7125: UDP, length 28
11:20:24.937126 IP 192.168.1.181.54555 > 255.255.255.255.7125: UDP, length 28
11:20:25.437201 IP 192.168.1.181.54555 > 255.255.255.255.7125: UDP, length 28
11:20:25.937180 IP 192.168.1.181.54555 > 255.255.255.255.7125: UDP, length 28
11:20:26.440383 IP 192.168.1.181.54555 > 255.255.255.255.7125: UDP, length 28
11:20:26.940447 IP 192.168.1.181.54555 > 255.255.255.255.7125: UDP, length 28
11:20:27.437209 IP 192.168.1.181.54555 > 255.255.255.255.7125: UDP, length 28
11:20:27.937184 IP 192.168.1.181.54555 > 255.255.255.255.7125: UDP, length 28
11:20:28.450317 IP 192.168.1.181.54555 > 255.255.255.255.7125: UDP, length 28
11:20:28.940376 IP 192.168.1.181.54555 > 255.255.255.255.7125: UDP, length 28
11:20:29.450397 IP 192.168.1.181.54555 > 255.255.255.255.7125: UDP, length 28
11:20:29.937182 IP 192.168.1.181.54555 > 255.255.255.255.7125: UDP, length 28
11:20:30.437194 IP 192.168.1.181.54555 > 255.255.255.255.7125: UDP, length 28
11:20:30.937176 IP 192.168.1.181.54555 > 255.255.255.255.7125: UDP, length 28
11:20:31.437187 IP 192.168.1.181.54555 > 255.255.255.255.7125: UDP, length 28
11:20:31.940306 IP 192.168.1.181.54555 > 255.255.255.255.7125: UDP, length 28
11:20:32.437198 IP 192.168.1.181.54555 > 255.255.255.255.7125: UDP, length 28
11:20:32.937180 IP 192.168.1.181.54555 > 255.255.255.255.7125: UDP, length 28
11:20:33.437205 IP 192.168.1.181.54555 > 255.255.255.255.7125: UDP, length 28
11:20:33.937188 IP 192.168.1.181.54555 > 255.255.255.255.7125: UDP, length 28
11:20:34.440400 IP 192.168.1.181.54555 > 255.255.255.255.7125: UDP, length 28
11:20:34.937188 IP 192.168.1.181.54555 > 255.255.255.255.7125: UDP, length 28
11:20:35.437199 IP 192.168.1.181.54555 > 255.255.255.255.7125: UDP, length 28
11:20:35.937176 IP 192.168.1.181.54555 > 255.255.255.255.7125: UDP, length 28
11:20:36.437207 IP 192.168.1.181.54555 > 255.255.255.255.7125: UDP, length 28
11:20:36.937191 IP 192.168.1.181.54555 > 255.255.255.255.7125: UDP, length 28
11:20:37.437186 IP 192.168.1.181.54555 > 255.255.255.255.7125: UDP, length 28
11:20:37.937182 IP 192.168.1.181.54555 > 255.255.255.255.7125: UDP, length 28
11:20:38.437200 IP 192.168.1.181.54555 > 255.255.255.255.7125: UDP, length 28
11:20:38.937179 IP 192.168.1.181.54555 > 255.255.255.255.7125: UDP, length 28
11:20:39.437207 IP 192.168.1.181.54555 > 255.255.255.255.7125: UDP, length 28
11:20:39.940376 IP 192.168.1.181.54555 > 255.255.255.255.7125: UDP, length 28
11:20:40.437206 IP 192.168.1.181.54555 > 255.255.255.255.7125: UDP, length 28
11:20:40.940374 IP 192.168.1.181.54555 > 255.255.255.255.7125: UDP, length 28
11:20:41.437191 IP 192.168.1.181.54555 > 255.255.255.255.7125: UDP, length 28
11:20:41.937193 IP 192.168.1.181.54555 > 255.255.255.255.7125: UDP, length 28
11:20:42.437207 IP 192.168.1.181.54555 > 255.255.255.255.7125: UDP, length 28
11:20:42.937173 IP 192.168.1.181.54555 > 255.255.255.255.7125: UDP, length 28
11:20:43.450427 IP 192.168.1.181.54555 > 255.255.255.255.7125: UDP, length 28
11:20:43.937173 IP 192.168.1.181.54555 > 255.255.255.255.7125: UDP, length 28
11:20:44.437205 IP 192.168.1.181.54555 > 255.255.255.255.7125: UDP, length 28
11:20:44.937187 IP 192.168.1.181.54555 > 255.255.255.255.7125: UDP, length 28
11:20:45.440325 IP 192.168.1.181.54555 > 255.255.255.255.7125: UDP, length 28
11:20:45.937184 IP 192.168.1.181.54555 > 255.255.255.255.7125: UDP, length 28
11:20:46.437206 IP 192.168.1.181.54555 > 255.255.255.255.7125: UDP, length 28
11:20:46.937203 IP 192.168.1.181.54555 > 255.255.255.255.7125: UDP, length 28
11:20:47.437194 IP 192.168.1.181.54555 > 255.255.255.255.7125: UDP, length 28
11:20:47.937172 IP 192.168.1.181.54555 > 255.255.255.255.7125: UDP, length 28
11:20:48.437196 IP 192.168.1.181.54555 > 255.255.255.255.7125: UDP, length 28
11:20:48.940411 IP 192.168.1.181.54555 > 255.255.255.255.7125: UDP, length 28
11:20:49.460399 IP 192.168.1.181.54555 > 255.255.255.255.7125: UDP, length 28
11:20:49.937180 IP 192.168.1.181.54555 > 255.255.255.255.7125: UDP, length 28
11:20:50.438190 IP 192.168.1.181.54555 > 255.255.255.255.7125: UDP, length 28
11:20:50.940358 IP 192.168.1.181.54555 > 255.255.255.255.7125: UDP, length 28
