Event send
tcpdump: verbose output suppressed, use -v[v]... for full protocol decode
listening on wlan0, link-type EN10MB (Ethernet), snapshot length 262144 bytes
15:51:02.465216 IP 10.42.0.221.50182 > 10.42.0.1.54523: UDP, length 36
15:51:03.470449 IP 10.42.0.221.50182 > 10.42.0.1.54523: UDP, length 36
15:51:04.466132 IP 10.42.0.221.50182 > 10.42.0.1.54523: UDP, length 36
15:51:05.466585 IP 10.42.0.221.50182 > 10.42.0.1.54523: UDP, length 36
15:51:06.467072 IP 10.42.0.221.50182 > 10.42.0.1.54523: UDP, length 36
15:51:07.467467 IP 10.42.0.221.50182 > 10.42.0.1.54523: UDP, length 36
15:51:08.467888 IP 10.42.0.221.50182 > 10.42.0.1.54523: UDP, length 36
15:51:09.468245 IP 10.42.0.221.50182 > 10.42.0.1.54523: UDP, length 36
15:51:10.468595 IP 10.42.0.221.50182 > 10.42.0.1.54523: UDP, length 36
15:51:11.469050 IP 10.42.0.221.50182 > 10.42.0.1.54523: UDP, length 36
15:51:12.469291 IP 10.42.0.221.50182 > 10.42.0.1.54523: UDP, length 36
15:51:13.470043 IP 10.42.0.221.50182 > 10.42.0.1.54523: UDP, length 36
15:51:14.470149 IP 10.42.0.221.50182 > 10.42.0.1.54523: UDP, length 36
15:51:15.470759 IP 10.42.0.221.50182 > 10.42.0.1.54523: UDP, length 36
15:51:16.472992 IP 10.42.0.221.50182 > 10.42.0.1.54523: UDP, length 36


Broadcast 
tcpdump: verbose output suppressed, use -v[v]... for full protocol decode
listening on wlan0, link-type EN10MB (Ethernet), snapshot length 262144 bytes
15:51:02.466227 IP 10.42.0.1.54555 > 10.42.0.255.54555: UDP, length 64
15:51:03.471569 IP 10.42.0.1.54555 > 10.42.0.255.54555: UDP, length 64
15:51:04.488172 IP 10.42.0.1.54555 > 10.42.0.255.54555: UDP, length 64
15:51:05.472940 IP 10.42.0.1.54555 > 10.42.0.255.54555: UDP, length 64
15:51:06.469195 IP 10.42.0.1.54555 > 10.42.0.255.54555: UDP, length 64
15:51:07.478175 IP 10.42.0.1.54555 > 10.42.0.255.54555: UDP, length 64
15:51:08.475200 IP 10.42.0.1.54555 > 10.42.0.255.54555: UDP, length 64
15:51:09.469060 IP 10.42.0.1.54555 > 10.42.0.255.54555: UDP, length 64
15:51:10.470638 IP 10.42.0.1.54555 > 10.42.0.255.54555: UDP, length 64
15:51:11.472386 IP 10.42.0.1.54555 > 10.42.0.255.54555: UDP, length 64
15:51:12.478206 IP 10.42.0.1.54555 > 10.42.0.255.54555: UDP, length 64
15:51:13.471660 IP 10.42.0.1.54555 > 10.42.0.255.54555: UDP, length 64
15:51:14.473479 IP 10.42.0.1.54555 > 10.42.0.255.54555: UDP, length 64
15:51:15.473183 IP 10.42.0.1.54555 > 10.42.0.255.54555: UDP, length 64
15:51:16.488170 IP 10.42.0.1.54555 > 10.42.0.255.54555: UDP, length 64
